{"r_version":"4.5.2","bioconductor":"3.22","packages":{"DESeq2":"Bioconductor","SummarizedExperiment":"Bioconductor","ggplot2":"CRAN","BiocGenerics":"Bioconductor"},"versions":{"DESeq2":"1.50.2","SummarizedExperiment":"1.40.0","BiocGenerics":"0.56.0","ggplot2":"4.0.3"},"dependency_edges":[{"package":"DESeq2","depends_on":"SummarizedExperiment","constraint":">= 1.1.6"}],"install_strategy":["install.packages('BiocManager') from CRAN if needed","BiocManager::install('DESeq2') resolves the Bioconductor release graph and CRAN dependencies"],"rationale":"DESeq2 is in Bioconductor 3.22 and imports ggplot2 from CRAN; its DESCRIPTION Depends on SummarizedExperiment >= 1.1.6. BiocManager is the release-aware installer.","sources":["https://bioconductor.org/packages/3.22/bioc/html/DESeq2.html","https://bioconductor.org/packages/3.22/bioc/html/BiocGenerics.html","https://bioconductor.org/packages/3.22/bioc/html/SummarizedExperiment.html"]}
